<?xml version="1.0" encoding="UTF-8"?>
<!-- SPDX-FileCopyrightText: 2025 (c) Joachim MARIE <moonstroke+github@live.fr>
     SPDX-License-Identifier: MIT -->
<test xmlns="http://moonstroke.github.io/xencha" xmlns:xsi="http://www.w3.org/2001/XMLSchema-instance" xsi:schemaLocation="http://moonstroke.github.io/xencha ../../main/xsd/test.xsd">
	<name>Tests for external source</name>
	<source>
		<path>data/extract-playlist-duration.xsl</path>
	</source>
	<cases>
		<case>
			<name>Test for external source with external input/output</name>
			<input>
				<path>data/playlists.xml</path>
			</input>
			<expectedOutput>
				<path>data/playlist-durations.xml</path>
			</expectedOutput>
		</case>
		<case>
			<name>Test for external source with embedded input/output</name>
			<input>
				<inline>
					<!-- TODO -->
				</inline>
			</input>
			<expectedOutput>
				<inline>
					<fo:root xmlns:fo="http://www.w3.org/1999/XSL/Format">
						<!-- TODO -->
					</fo:root>
				</inline>
			</expectedOutput>
		</case>
	</cases>
</test>